{
  "schema_version": "0.1.0",
  "id": "finite_difference.lax_friedrichs_monotone_1d",
  "title": "Scalar Lax-Friedrichs update is monotone under the CFL condition",
  "domain": "finite_difference",
  "category": "finite_difference_stability",
  "difficulty": 3,
  "proof_status": "complete",
  "source": {
    "kind": "textbook",
    "citation": "Randall J. LeVeque, Finite Volume Methods for Hyperbolic Problems, Cambridge University Press, 2002, Sec. 12.5, p. 232.",
    "notes": "Generated from checked Lean ground truth; source repository withheld during public release."
  },
  "informal": {
    "statement": "If -1 <= cfl <= 1, uLeft <= vLeft, and uRight <= vRight, then the scalar Lax-Friedrichs update at (uLeft, uRight) is less than or equal to the update at (vLeft, vRight).",
    "latex": "If \\(-1\\le\\lambda\\le1\\), \\(u_L\\le v_L\\), and \\(u_R\\le v_R\\), then \\(((1+\\lambda)/2)u_L+((1-\\lambda)/2)u_R\\le((1+\\lambda)/2)v_L+((1-\\lambda)/2)v_R\\).",
    "assumptions": [
      "cfl, uLeft, uRight, vLeft, and vRight are real numbers",
      "-1 <= cfl",
      "cfl <= 1",
      "uLeft <= vLeft",
      "uRight <= vRight"
    ],
    "expected_conclusion": "The scalar Lax-Friedrichs update is monotone in both neighboring input values under the CFL condition."
  },
  "formal": {
    "language": "Lean 4",
    "lean_version": "leanprover/lean4:v4.29.1",
    "repository": "LeanNumerics companion source",
    "commit": "withheld during public release",
    "file": "LeanNumerics/FiniteDifference/LaxFriedrichs.lean",
    "imports": [
      "Mathlib.Tactic"
    ],
    "namespace": [
      "LeanNumerics",
      "FiniteDifference"
    ],
    "declarations": [
      {
        "name": "laxFriedrichsStep",
        "kind": "definition",
        "statement": "def laxFriedrichsStep (cfl uLeft uRight : ℝ) : ℝ := laxFriedrichsLeftWeight cfl * uLeft + laxFriedrichsRightWeight cfl * uRight"
      },
      {
        "name": "laxFriedrichsStep_monotone",
        "kind": "theorem",
        "statement": "theorem laxFriedrichsStep_monotone (cfl uLeft uRight vLeft vRight : ℝ) (hcflLower : -1 ≤ cfl) (hcflUpper : cfl ≤ 1) (hLeft : uLeft ≤ vLeft) (hRight : uRight ≤ vRight) : laxFriedrichsStep cfl uLeft uRight ≤ laxFriedrichsStep cfl vLeft vRight"
      }
    ],
    "compilation": {
      "command": "lake build LeanNumerics",
      "passed": true
    }
  },
  "tasks": [
    {
      "task": "statement_translation",
      "input": "Translate the scalar Lax-Friedrichs monotonicity statement into Lean 4 using laxFriedrichsStep.",
      "target": "theorem laxFriedrichsStep_monotone (cfl uLeft uRight vLeft vRight : ℝ) (hcflLower : -1 ≤ cfl) (hcflUpper : cfl ≤ 1) (hLeft : uLeft ≤ vLeft) (hRight : uRight ≤ vRight) : laxFriedrichsStep cfl uLeft uRight ≤ laxFriedrichsStep cfl vLeft vRight"
    },
    {
      "task": "proof_completion",
      "input": "Given the weight nonnegativity theorem and the step definition, complete the Lean 4 proof.",
      "target": "A proof using laxFriedrichsWeights_nonneg, mul_le_mul_of_nonneg_left, and linarith."
    },
    {
      "task": "theorem_retrieval",
      "input": "Find the LeanNumerics theorem needed to prove monotonicity of the Lax-Friedrichs convex combination.",
      "target": "laxFriedrichsWeights_nonneg"
    }
  ],
  "mathlib": {
    "imports": [
      "Mathlib.Tactic"
    ],
    "known_missing_lemmas": []
  },
  "tags": [
    "lax_friedrichs",
    "finite_difference",
    "finite_volume",
    "advection",
    "cfl",
    "monotonicity",
    "convex_combination",
    "linarith"
  ],
  "license": "CC-BY-4.0 for benchmark metadata; Lean source follows LeanNumerics repository license"
}
