{
  "schema_version": "0.1.0",
  "id": "interpolation_linear.linear_interp_at_left",
  "title": "Linear interpolation matches the left endpoint",
  "domain": "interpolation",
  "category": "interpolation_linear",
  "difficulty": 3,
  "proof_status": "complete",
  "source": {
    "kind": "textbook",
    "citation": "Alfio Quarteroni, Riccardo Sacco, and Fausto Saleri, Numerical Mathematics, 2nd ed., Springer, 2007, Ch. 8 (Polynomial Interpolation).",
    "notes": "Generated from checked Lean ground truth; source repository withheld during public release."
  },
  "informal": {
    "statement": "If the interpolation interval has nonzero length, the two-point linear interpolant evaluated at the left node returns the left datum.",
    "latex": "L(x_0)=y_0.",
    "assumptions": [
      "x1 - x0 is nonzero"
    ],
    "expected_conclusion": "The linear interpolant matches y0 at x0."
  },
  "formal": {
    "language": "Lean 4",
    "lean_version": "leanprover/lean4:v4.29.1",
    "repository": "LeanNumerics companion source",
    "commit": "withheld during public release",
    "file": "LeanNumerics/Interpolation/Linear.lean",
    "imports": [
      "Mathlib.Tactic"
    ],
    "namespace": [
      "LeanNumerics",
      "Interpolation"
    ],
    "compilation": {
      "command": "lake build LeanNumerics",
      "passed": true
    },
    "declarations": [
      {
        "name": "linearInterp",
        "kind": "definition",
        "statement": "def linearInterp (x0 x1 y0 y1 x : Real) : Real := ((x1 - x) / (x1 - x0)) * y0 + ((x - x0) / (x1 - x0)) * y1"
      },
      {
        "name": "linearInterp_at_left",
        "kind": "theorem",
        "statement": "theorem linearInterp_at_left (x0 x1 y0 y1 : Real) (h : x1 - x0 ≠ 0) : linearInterp x0 x1 y0 y1 x0 = y0"
      }
    ]
  },
  "tasks": [
    {
      "task": "statement_translation",
      "input": "Translate the interpolation theorem `linearInterp_at_left` into Lean 4.",
      "target": "theorem linearInterp_at_left (x0 x1 y0 y1 : Real) (h : x1 - x0 ≠ 0) : linearInterp x0 x1 y0 y1 x0 = y0"
    },
    {
      "task": "proof_completion",
      "input": "Complete the Lean proof of `linearInterp_at_left`.",
      "target": "unfold linearInterp; field_simp [h]; ring"
    },
    {
      "task": "theorem_retrieval",
      "input": "Identify the main algebraic or order lemma needed for the interpolation proof.",
      "target": "field_simp"
    }
  ],
  "mathlib": {
    "imports": [
      "Mathlib.Tactic"
    ],
    "known_missing_lemmas": []
  },
  "tags": [
    "interpolation",
    "linear_interpolation",
    "affine_combination",
    "numerical_analysis",
    "ring",
    "theorem_retrieval",
    "endpoint_exactness"
  ],
  "license": "CC-BY-4.0 for benchmark metadata; Lean source follows LeanNumerics repository license"
}
