{
  "schema_version": "0.1.0",
  "id": "finite_difference.kdv_canonical_update_zero_scale_1d",
  "title": "A zero-scale canonical KdV update leaves the state unchanged",
  "domain": "finite_difference",
  "category": "finite_difference_kdv",
  "difficulty": 1,
  "proof_status": "complete",
  "source": {
    "kind": "internal_lean_seed",
    "citation": "LeanNumerics companion source",
    "notes": "Generated from checked Lean ground truth; source repository withheld during public release."
  },
  "informal": {
    "statement": "If the scale is zero, the canonical KdV conservative update is the identity update.",
    "latex": "If \\(\\lambda=0\\), then \\(u_i^+=u_i\\).",
    "assumptions": [
      "all scalar parameters are real numbers",
      "u is a real-valued grid state on natural-number indices",
      "n and i are natural-number grid or range indices as used in the theorem statement",
      "the KdV scaffold definitions are those in LeanNumerics.FiniteDifference.Kdv"
    ],
    "expected_conclusion": "The zero-scale canonical update returns the original state."
  },
  "formal": {
    "language": "Lean 4",
    "lean_version": "leanprover/lean4:v4.29.1",
    "repository": "LeanNumerics companion source",
    "commit": "withheld during public release",
    "file": "LeanNumerics/FiniteDifference/Kdv.lean",
    "imports": [
      "Mathlib.Tactic",
      "LeanNumerics.FiniteDifference.Conservation"
    ],
    "namespace": [
      "LeanNumerics",
      "FiniteDifference"
    ],
    "declarations": [
      {
        "name": "kdvCanonicalUpdate_zero_scale",
        "kind": "theorem",
        "statement": "theorem kdvCanonicalUpdate_zero_scale (u : Nat -> Real) (i : Nat) : kdvCanonicalUpdate 0 u i = u i"
      }
    ],
    "compilation": {
      "command": "lake build LeanNumerics",
      "passed": true
    }
  },
  "tasks": [
    {
      "task": "statement_translation",
      "input": "Translate this KdV conservative scaffold theorem into Lean 4: If the scale is zero, the canonical KdV conservative update is the identity update.",
      "target": "theorem kdvCanonicalUpdate_zero_scale (u : Nat -> Real) (i : Nat) : kdvCanonicalUpdate 0 u i = u i"
    },
    {
      "task": "proof_completion",
      "input": "Given the KdV scaffold definitions and referenced conservation lemmas, complete the Lean 4 proof.",
      "target": "A proof by unfolding kdvCanonicalUpdate and reusing kdvConservativeUpdate_zero_scale."
    }
  ],
  "mathlib": {
    "imports": [
      "Mathlib.Tactic"
    ],
    "known_missing_lemmas": []
  },
  "tags": [
    "kdv",
    "finite_difference",
    "canonical_update",
    "zero_scale",
    "identity_update"
  ],
  "license": "CC-BY-4.0 for benchmark metadata; Lean source follows LeanNumerics repository license"
}
