{
  "schema_version": "0.1.0",
  "id": "finite_difference.burgers_total_update_boundary_1d",
  "title": "Burgers conservative update preserves total when boundary fluxes agree",
  "domain": "finite_difference",
  "category": "finite_difference_burgers",
  "difficulty": 2,
  "proof_status": "complete",
  "source": {
    "kind": "textbook",
    "citation": "Randall J. LeVeque, Finite Volume Methods for Hyperbolic Problems, Cambridge University Press, 2002, Sec. 11.3, p. 208 and Ch. 4, pp. 64-65.",
    "notes": "Generated from checked Lean ground truth; source repository withheld during public release."
  },
  "informal": {
    "statement": "If the Burgers flux agrees at the two boundary endpoints, then the finite total is preserved by the Burgers conservative update.",
    "latex": "If \\(F_n=F_0\\), then \\(\\sum_i u_i^+=\\sum_i u_i\\).",
    "assumptions": [
      "scale is a real update scale",
      "u is a real-valued grid state on natural-number indices",
      "n is a natural-number range length",
      "burgersFlux u n = burgersFlux u 0"
    ],
    "expected_conclusion": "Boundary flux equality implies total preservation for the Burgers update."
  },
  "formal": {
    "language": "Lean 4",
    "lean_version": "leanprover/lean4:v4.29.1",
    "repository": "LeanNumerics companion source",
    "commit": "withheld during public release",
    "file": "LeanNumerics/FiniteDifference/Burgers.lean",
    "imports": [
      "Mathlib.Tactic",
      "LeanNumerics.FiniteDifference.Conservation"
    ],
    "namespace": [
      "LeanNumerics",
      "FiniteDifference"
    ],
    "declarations": [
      {
        "name": "burgersConservativeUpdate",
        "kind": "definition",
        "statement": "def burgersConservativeUpdate (scale : Real) (u : Nat -> Real) (i : Nat) : Real := conservativeUpdate scale u (burgersFlux u) i"
      },
      {
        "name": "totalOn_burgersConservativeUpdate_of_boundary_eq",
        "kind": "theorem",
        "statement": "theorem totalOn_burgersConservativeUpdate_of_boundary_eq (scale : Real) (u : Nat -> Real) (n : Nat) (hflux : burgersFlux u n = burgersFlux u 0) : totalOn (fun i => burgersConservativeUpdate scale u i) n = totalOn u n"
      }
    ],
    "compilation": {
      "command": "lake build LeanNumerics",
      "passed": true
    }
  },
  "tasks": [
    {
      "task": "statement_translation",
      "input": "Translate this Burgers conservative finite-difference theorem into Lean 4: If the Burgers flux agrees at the two boundary endpoints, then the finite total is preserved by the Burgers conservative update.",
      "target": "theorem totalOn_burgersConservativeUpdate_of_boundary_eq (scale : Real) (u : Nat -> Real) (n : Nat) (hflux : burgersFlux u n = burgersFlux u 0) : totalOn (fun i => burgersConservativeUpdate scale u i) n = totalOn u n"
    },
    {
      "task": "proof_completion",
      "input": "Given the Burgers scaffold definitions and referenced conservation lemmas, complete the Lean 4 proof.",
      "target": "A proof by unfolding burgersConservativeUpdate and applying totalOn_conservativeUpdate_of_boundary_eq."
    },
    {
      "task": "theorem_retrieval",
      "input": "Find the generic conservation theorem proving total preservation when boundary fluxes agree.",
      "target": "totalOn_conservativeUpdate_of_boundary_eq"
    }
  ],
  "mathlib": {
    "imports": [
      "Mathlib.Tactic"
    ],
    "known_missing_lemmas": []
  },
  "tags": [
    "burgers",
    "nonlinear_flux",
    "finite_difference",
    "finite_volume",
    "conservation",
    "total_preservation",
    "boundary_flux"
  ],
  "license": "CC-BY-4.0 for benchmark metadata; Lean source follows LeanNumerics repository license"
}
