{
  "schema_version": "0.1.0",
  "id": "finite_difference.kdv_canonical_flux_const_1d",
  "title": "The canonical KdV flux of a constant state is three c squared",
  "domain": "finite_difference",
  "category": "finite_difference_kdv",
  "difficulty": 1,
  "proof_status": "complete",
  "source": {
    "kind": "internal_lean_seed",
    "citation": "LeanNumerics companion source",
    "notes": "Generated from checked Lean ground truth; source repository withheld during public release."
  },
  "informal": {
    "statement": "For a constant state, the canonical KdV-like flux reduces to 3*c^2 because the second forward difference vanishes.",
    "latex": "If \\(u_i=c\\), then \\(F_i^{KdV}=3c^2\\).",
    "assumptions": [
      "all scalar parameters are real numbers",
      "u is a real-valued grid state on natural-number indices",
      "n and i are natural-number grid or range indices as used in the theorem statement",
      "the KdV scaffold definitions are those in LeanNumerics.FiniteDifference.Kdv"
    ],
    "expected_conclusion": "The canonical flux is constant on constant states."
  },
  "formal": {
    "language": "Lean 4",
    "lean_version": "leanprover/lean4:v4.29.1",
    "repository": "LeanNumerics companion source",
    "commit": "withheld during public release",
    "file": "LeanNumerics/FiniteDifference/Kdv.lean",
    "imports": [
      "Mathlib.Tactic",
      "LeanNumerics.FiniteDifference.Conservation"
    ],
    "namespace": [
      "LeanNumerics",
      "FiniteDifference"
    ],
    "declarations": [
      {
        "name": "kdvCanonicalFlux_const",
        "kind": "theorem",
        "statement": "theorem kdvCanonicalFlux_const (c : Real) (i : Nat) : kdvCanonicalFlux (fun _ => c) i = 3 * c ^ 2"
      }
    ],
    "compilation": {
      "command": "lake build LeanNumerics",
      "passed": true
    }
  },
  "tasks": [
    {
      "task": "statement_translation",
      "input": "Translate this KdV conservative scaffold theorem into Lean 4: For a constant state, the canonical KdV-like flux reduces to 3*c^2 because the second forward difference vanishes.",
      "target": "theorem kdvCanonicalFlux_const (c : Real) (i : Nat) : kdvCanonicalFlux (fun _ => c) i = 3 * c ^ 2"
    },
    {
      "task": "proof_completion",
      "input": "Given the KdV scaffold definitions and referenced conservation lemmas, complete the Lean 4 proof.",
      "target": "A proof by reusing kdvConservativeFlux_const at coefficients 3 and 1."
    }
  ],
  "mathlib": {
    "imports": [
      "Mathlib.Tactic"
    ],
    "known_missing_lemmas": []
  },
  "tags": [
    "kdv",
    "finite_difference",
    "canonical_flux",
    "constant_state",
    "ring"
  ],
  "license": "CC-BY-4.0 for benchmark metadata; Lean source follows LeanNumerics repository license"
}
