{
  "schema_version": "0.1.0",
  "id": "fem_projection.weighted_p0_projection_l2_contract_2cell",
  "title": "The weighted two-cell P0 projection is L2-stable",
  "domain": "fem",
  "category": "fem_projection",
  "difficulty": 3,
  "proof_status": "complete",
  "source": {
    "kind": "internal_lean_seed",
    "citation": "LeanNumerics companion source",
    "notes": "Generated from checked Lean ground truth; source repository withheld during public release."
  },
  "informal": {
    "statement": "For nonnegative masses and nonzero total mass, the weighted squared L2 energy of the P0 projection is no larger than the original weighted energy.",
    "latex": "||Pi_w u||_w^2 <= ||u||_w^2.",
    "assumptions": [
      "0 <= m0",
      "0 <= m1",
      "m0 + m1 is nonzero"
    ],
    "expected_conclusion": "The weighted projected energy is bounded above by the original weighted energy."
  },
  "formal": {
    "language": "Lean 4",
    "lean_version": "leanprover/lean4:v4.29.1",
    "repository": "LeanNumerics companion source",
    "commit": "withheld during public release",
    "file": "LeanNumerics/FEM/Projection.lean",
    "imports": [
      "Mathlib.Tactic"
    ],
    "namespace": [
      "LeanNumerics",
      "FEM"
    ],
    "compilation": {
      "command": "lake build LeanNumerics",
      "passed": true
    },
    "declarations": [
      {
        "name": "weightedP0Projection2_l2_contract",
        "kind": "theorem",
        "statement": "theorem weightedP0Projection2_l2_contract (m0 m1 u0 u1 : Real) (hm0 : 0 <= m0) (hm1 : 0 <= m1) (hsum : m0 + m1 ≠ 0) : weightedCellL2Sq2 m0 m1 (weightedP0Projection2Left m0 m1 u0 u1) (weightedP0Projection2Right m0 m1 u0 u1) <= weightedCellL2Sq2 m0 m1 u0 u1"
      }
    ]
  },
  "tasks": [
    {
      "task": "statement_translation",
      "input": "Translate weighted L2 stability of the two-cell P0 projection into Lean 4.",
      "target": "theorem weightedP0Projection2_l2_contract (m0 m1 u0 u1 : Real) (hm0 : 0 <= m0) (hm1 : 0 <= m1) (hsum : m0 + m1 ≠ 0) : weightedCellL2Sq2 m0 m1 (weightedP0Projection2Left m0 m1 u0 u1) (weightedP0Projection2Right m0 m1 u0 u1) <= weightedCellL2Sq2 m0 m1 u0 u1"
    },
    {
      "task": "proof_completion",
      "input": "Complete the Lean proof by rewriting with the weighted Pythagorean identity and using nonnegativity of residual energy.",
      "target": "Rewrite by weightedP0Projection2_pythagorean, then use weightedP0ProjectionResidualSq2_nonneg and le_add_of_nonneg_right."
    },
    {
      "task": "theorem_retrieval",
      "input": "Find the LeanNumerics identity and nonnegativity lemma needed for weighted L2 stability.",
      "target": "weightedP0Projection2_pythagorean; weightedP0ProjectionResidualSq2_nonneg"
    }
  ],
  "mathlib": {
    "imports": [
      "Mathlib.Tactic"
    ],
    "known_missing_lemmas": []
  },
  "tags": [
    "fem",
    "projection",
    "weighted_projection",
    "l2_stability",
    "energy_estimate",
    "theorem_retrieval"
  ],
  "license": "CC-BY-4.0 for benchmark metadata; Lean source follows LeanNumerics repository license"
}
